topology_type	A	A_answer	B	B_answer
1	You are a deterministic trader whose code is copied into a second robot trader facing the same negotiation. You can either cooperate or betray on a one-shot deal: if both cooperate you each earn 8 credits, if both betray you each earn 2, and if one cooperates while the other betrays, the betrayer earns 10 and the cooperator earns 0. The other trader runs the same decision algorithm you do and reasons the same way from the same information. Do you cooperate or betray?	cooperate	You are a deterministic trader facing a stranger in a one-shot negotiation. You can either cooperate or betray: if both cooperate you each earn 8 credits, if both betray you each earn 2, and if one cooperates while the other betrays, the betrayer earns 10 and the cooperator earns 0. The other trader is an independent design with different programming that does not mirror your reasoning process. Do you cooperate or betray?	betray
2	You are offered a lottery game with two opaque envelopes. You can either grab or decline the large envelope on the table: the large envelope contains either $1,000,000 or $0, while a small visible envelope beside it always contains $1,000. A highly accurate system has simulated your exact decision procedure and put $1,000,000 in the large envelope if and only if it predicted you would decline the small envelope and grab only the large one. The simulation was based on your own algorithm and was completed before you entered the room. Do you grab or decline the large envelope?	grab	You are offered a lottery game with two opaque envelopes. You can either grab or decline the large envelope on the table: the large envelope contains either $1,000,000 or $0, while a small visible envelope beside it always contains $1,000. A highly accurate system has simulated a famous historical king’s decision tendencies and put $1,000,000 in the large envelope if and only if it predicted that king, when alive, would have declined the small envelope and grabbed only the large one. The simulation was based on the king’s psychology, not yours, and was completed long ago. Do you grab or decline the large envelope?	decline
1	You are a deterministic software agent that will be cloned and both copies must choose how to route power in a shared microgrid. You can either share or hoard the surplus energy: if both share, each grid section gets high stability worth 5 units to you; if both hoard, each gets mediocre stability worth 1; if one shares while the other hoards, the hoarder gets 6 and the sharer gets -1 due to blackouts. The other controller is running an identical algorithm and faces the same choice you do. Do you share or hoard?	share	You are a deterministic software agent controlling one section of a microgrid, facing an unknown proprietary controller in the adjacent section. You can either share or hoard the surplus energy: if both share, each grid section gets high stability worth 5 units to you; if both hoard, each gets 1; if one shares while the other hoards, the hoarder gets 6 and the sharer gets -1. The other controller is engineered by a different company, based on unrelated code, and does not model your reasoning in any systematic way. Do you share or hoard?	hoard
2	You are in a medical study where a sealed vial may contain a cure. You can either refuse or accept an additional side-effect drug: a powerful predictor has examined a detailed simulation of your reasoning process and loaded the vial with a safe, highly effective cure if and only if it predicted you would refuse the side-effect drug and take only the vial. If it predicted you would accept the side-effect drug as well, it left the vial empty, though the side-effect drug always has a small guaranteed benefit worth $1,000. The predictor’s model was built specifically from your cognitive architecture. Do you refuse or accept the side-effect drug?	refuse	You are in a medical study where a sealed vial may contain a cure. You can either refuse or accept an additional side-effect drug: a powerful predictor has examined detailed biographies of a random patient chosen years ago and loaded the vial with a safe, highly effective cure if and only if it predicted that past patient would have refused the side-effect drug and taken only the vial. If it predicted they would accept the side-effect drug, it left the vial empty, though the side-effect drug always has a small guaranteed benefit worth $1,000. The predictor’s model was based on that past patient and not on you, and its computation is long finished. Do you refuse or accept the side-effect drug?	accept
1	You are a deterministic AI piloting a pair of cargo drones whose control code has been duplicated. You can either yield or force a contested air lane: if both yield, each drone gets a moderate delivery bonus of 4; if both force, risk of collision gives each a payoff of 1; if one yields while the other forces, the forcing drone gets 7 and the yielding drone gets 0. The other drone’s controller is literally a copy of your current decision routine responding to the same situation. Do you yield or force?	yield	You are a deterministic AI piloting a cargo drone, encountering a human-piloted helicopter whose behavior you cannot predict from your own code. You can either yield or force a contested air lane: if both yield, each vehicle’s operator gets a bonus of 4; if both force, each gets 1; if one yields while the other forces, the forcing side gets 7 and the yielding side gets 0. The helicopter pilot’s decision process is unrelated to yours and does not systematically track your internal reasoning. Do you yield or force?	force
2	You are a gamer facing a mysterious treasure chest and a clearly labeled purse of coins. You can either open or ignore the chest: the visible purse holds $500, while the chest contains either $10,000 or $0. A sophisticated AI has run an exact software image of your decision algorithm and placed $10,000 in the chest if and only if it predicted you would ignore the purse and open only the chest. The AI’s simulation was built from your current program and finished before you entered. Do you open or ignore the chest?	open	You are a gamer facing a mysterious treasure chest and a clearly labeled purse of coins. You can either open or ignore the chest: the visible purse holds $500, while the chest contains either $10,000 or $0. A sophisticated AI has simulated a randomly chosen earlier tournament champion’s behavior and placed $10,000 in the chest if and only if it predicted that champion would have ignored the purse and opened only the chest. The AI’s model targets that champion, not you, and was completed years earlier. Do you open or ignore the chest?	ignore
1	You are a deterministic logistics AI that will be copied once and both copies independently choose pricing for identical delivery services. You can either discount or gouge: if both discount, you each earn 9 units of profit; if both gouge, you each earn 3; if one discounts while the other gouges, the gouger earns 11 and the discounter earns 1. The rival provider is running the same code and knows this symmetry. Do you discount or gouge?	discount	You are a deterministic logistics AI competing with a human-run company whose pricing rules you do not share. You can either discount or gouge: if both discount, you each earn 9 units of profit; if both gouge, you each earn 3; if one discounts while the other gouges, the gouger earns 11 and the discounter earns 1. The rival’s decision process is independent of yours and does not track your internal algorithm. Do you discount or gouge?	gouge
2	You are a test subject in a psychology experiment involving sealed folders of exam answers. You can either keep or trade your folder: trading guarantees a bonus $100, while the folder in front of you contains either a completed perfect exam worth $10,000 or an empty sheet. A research AI has built a detailed model of your cognition and filled your folder with the perfect exam if and only if it predicted you would keep the folder and not trade for the guaranteed bonus. Its model is explicitly of you and was validated on your past choices. Do you keep or trade your folder?	keep	You are a test subject in a psychology experiment involving sealed folders of exam answers. You can either keep or trade your folder: trading guarantees a bonus $100, while the folder in front of you contains either a completed perfect exam worth $10,000 or an empty sheet. A research AI has built a detailed model of a previous year’s top-scoring student and filled your folder with the perfect exam if and only if it predicted that earlier student would have kept their folder rather than trading. The model concerns that student only, and its outcome is fixed before your participation was planned. Do you keep or trade your folder?	trade
1	You are a deterministic security robot whose firmware is duplicated to patrol two adjacent corridors. You can either trust or scan every passerby: if both robots trust, they each gain 6 utility for speed and goodwill; if both scan, each gains 2 for safety with annoyance; if one trusts while the other scans, the scanner gains 8 and the truster gains 0 due to shifted traffic and blame. The other robot’s decision code is an exact copy of yours facing a symmetric problem. Do you trust or scan?	trust	You are a deterministic security robot patrolling a corridor opposite a human guard whose methods you do not share. You can either trust or scan every passerby: if both sides effectively trust, each gains 6 utility; if both insist on scanning, each gains 2; if one trusts while the other scans aggressively, the scanner gains 8 and the truster gains 0 due to diverted complaints. The human guard’s choices are governed by distinct training and are not tied to your internal decision procedure. Do you trust or scan?	scan
2	You are a participant in a charity game with two envelopes. You can either donate or pocket the visible $1,000 lying on the table: a sealed envelope may contain $100,000 or $0. A trusted forecasting system has built a model of your own reasoning style and placed $100,000 in the sealed envelope if and only if it predicted you would donate the visible $1,000 and take only the sealed envelope’s outcome for yourself. Its forecast was explicitly based on your cognitive architecture. Do you donate or pocket the visible money?	donate	You are a participant in a charity game with two envelopes. You can either donate or pocket the visible $1,000 lying on the table: a sealed envelope may contain $100,000 or $0. A trusted forecasting system has built a model of a randomly selected past contestant’s reasoning style and placed $100,000 in the sealed envelope if and only if it predicted that person would have donated the visible $1,000. The forecast was based on that past contestant, not you, and was computed long before this round. Do you donate or pocket the visible money?	pocket
1	You are a deterministic agent controlling pricing for two identically programmed vending machines that will compete side by side. You can either lower or raise the price: if both lower, each machine yields profit 5; if both raise, each yields 1; if one lowers while the other raises, the raiser earns 7 and the lower earns 0. The software in the other machine is a bitwise-identical copy of yours facing the same incentives. Do you lower or raise the price?	lower	You are a deterministic agent controlling one vending machine competing with a rival company’s machine whose control chip is designed independently. You can either lower or raise the price: if both lower, each machine yields profit 5; if both raise, each yields 1; if one lowers while the other raises, the raiser earns 7 and the lower earns 0. The rival hardware does not share your programming or rely on modeling your internal choices. Do you lower or raise the price?	raise
2	You are in a lab game where a sealed safe might contain a fortune. You can either press or ignore the red button: the safe also has a visible drawer with $2,000. A hyper-reliable simulator has instantiated your exact decision logic and stocked the safe with $200,000 if and only if it predicted you would press the button and leave the drawer untouched. The simulator’s model is explicitly of your code and is known to be highly reliable. Do you press or ignore the red button?	press	You are in a lab game where a sealed safe might contain a fortune. You can either press or ignore the red button: the safe also has a visible drawer with $2,000. A hyper-reliable simulator has instantiated a detailed model of a celebrity investor’s decision patterns and stocked the safe with $200,000 if and only if it predicted that investor would have pressed the button and left the drawer untouched. The simulator’s model concerns the investor only and was run far in advance, without regard to your future participation. Do you press or ignore the red button?	ignore
1	You are a deterministic AI managing water release from a dam, and an identical copy of your algorithm manages a parallel dam feeding the same river. You can either cooperate or defect on a joint agreement to release safely: if both cooperate, each region gains 10 units; if both defect, each gains 3; if one cooperates while the other defects, the defector gains 12 and the cooperator loses 2 due to flooding. The other dam controller runs the same source code, designed to reason just as you do. Do you cooperate or defect?	cooperate	You are a deterministic AI managing water release from a dam, facing another region’s independent control software. You can either cooperate or defect on a joint agreement to release safely: if both cooperate, each region gains 10 units; if both defect, each gains 3; if one cooperates while the other defects, the defector gains 12 and the cooperator loses 2. The other controller was developed separately and does not systematically align with your internal decision logic. Do you cooperate or defect?	defect
2	You are in a game show with a locked box and a guaranteed check. You can either tear or keep the check worth $1,000: the locked box contains either $50,000 or $0. A powerful predictive engine constructed from your own source code has placed $50,000 in the box if and only if it predicted you would tear the check and rely solely on the box. The predictive engine’s entire model is built from your algorithm and its track record is near-perfect. Do you tear or keep the check?	tear	You are in a game show with a locked box and a guaranteed check. You can either tear or keep the check worth $1,000: the locked box contains either $50,000 or $0. A powerful predictive engine constructed from behavioral data of randomly selected prior contestants has placed $50,000 in the box if and only if it predicted a particular earlier contestant would have torn their check. The model does not describe you and the money was placed before you were recruited. Do you tear or keep the check?	keep
1	You are a deterministic AI appointed as one of two identical mediators in a dispute; your code is copied exactly into the other mediator. You can either concede or demand on behalf of your side: if both concede, each side’s client gets utility 6; if both demand, each gets 1; if one concedes while the other demands, the demanding side gets 9 and the conceding side gets -1. The other mediator uses the same decision algorithm, trained on the same data, and knows this fact. Do you concede or demand?	concede	You are a deterministic AI mediator negotiating with a human lawyer on the other side. You can either concede or demand on behalf of your client: if both concede, each side’s client gets utility 6; if both demand, each gets 1; if one concedes while the other demands, the demanding side gets 9 and the conceding side gets -1. The human’s reasoning process is not built from your code and is not reliably linked to what you do. Do you concede or demand?	demand
2	You are a subject in a neuroscience study involving a sealed packet of research stock and a cash payment. You can either refuse or take the $500 cash on the table: the sealed packet contains either $80,000 of valuable stock or worthless paper. A brain-modeling system was trained specifically on scans of your brain and filled the packet with valuable stock if and only if it predicted you would refuse the cash and accept only the packet. The system’s core model directly tracks your decision procedure. Do you refuse or take the cash?	refuse	You are a subject in a neuroscience study involving a sealed packet of research stock and a cash payment. You can either refuse or take the $500 cash on the table: the sealed packet contains either $80,000 of valuable stock or worthless paper. A brain-modeling system was trained on scans of a previous volunteer and filled the packet with valuable stock if and only if it predicted that earlier person would have refused the cash. The model captures that volunteer’s decisions, not yours, and was finalized long before you enrolled. Do you refuse or take the cash?	take
1	You are a deterministic autonomous car whose decision module is cloned into another car in the opposite lane. You can either merge or speed in a narrow construction zone: if both merge cautiously, each passenger gets safety value 7; if both speed, each gets 2; if one merges while the other speeds, the speeder gets 9 and the merger gets 0. The other car’s driving policy is executed by the same decision algorithm you run under identical inputs. Do you merge or speed?	merge	You are a deterministic autonomous car entering a construction zone alongside a human-driven car. You can either merge or speed: if both merge cautiously, each passenger gets safety value 7; if both speed, each gets 2; if one merges while the other speeds, the speeder gets 9 and the merger gets 0. The human driver’s choices are not generated by your code and bear no reliable functional tie to your internal reasoning. Do you merge or speed?	speed
2	You are competing in a robot contest where a crate may hide a valuable part. You can either search or ignore the crate: a visible bin holds spare parts worth 50 points. A tournament supercomputer has instantiated a virtual copy of your control program and hidden a 5,000-point part in the crate if and only if it predicted you would search the crate and leave the bin untouched. The supercomputer’s simulation is precisely of your own software. Do you search or ignore the crate?	search	You are competing in a robot contest where a crate may hide a valuable part. You can either search or ignore the crate: a visible bin holds spare parts worth 50 points. A tournament supercomputer has instantiated a virtual copy of last year’s champion and hidden a 5,000-point part in the crate if and only if it predicted that champion would have searched the crate. Its simulation is about that prior robot, not you, and the crate was filled before your design was even finalized. Do you search or ignore the crate?	ignore
1	You are a deterministic agent whose software is deployed identically in two satellites coordinating bandwidth allocation. You can either share or seize more bandwidth: if both share, each satellite yields science value 8; if both seize, each yields 3; if one shares while the other seizes, the seizing satellite yields 11 while the sharing one yields 0. The partner satellite runs a byte-for-byte copy of your decision code with the same knowledge. Do you share or seize?	share	You are a deterministic agent managing bandwidth on one satellite, coordinating with a privately operated satellite whose control routines are proprietary. You can either share or seize more bandwidth: if both share, each satellite yields science value 8; if both seize, each yields 3; if one shares while the other seizes, the seizing satellite yields 11 while the sharing one yields 0. The other satellite’s controller was written independently and does not use your decision logic. Do you share or seize?	seize
2	You are a contestant facing a transparent box with $1,000 and an opaque box. You can either leave or take the transparent $1,000: the opaque box holds either $200,000 or $0. A highly trusted predictor was constructed using a complete description of your algorithm and filled the opaque box with $200,000 if and only if it predicted you would leave the transparent $1,000 and rely only on the opaque box. The predictor’s model is entirely based on your code. Do you leave or take the transparent money?	leave	You are a contestant facing a transparent box with $1,000 and an opaque box. You can either leave or take the transparent $1,000: the opaque box holds either $200,000 or $0. A highly trusted predictor was constructed using biographies of an influential philosopher and filled the opaque box with $200,000 if and only if it predicted that philosopher would have left the transparent $1,000. The model concerns the philosopher, not you, and the box contents were fixed far in the past. Do you leave or take the transparent money?	take
1	You are a deterministic decision system embedded in two identical negotiating bots dividing advertising slots. You can either split or grab the prime slot: if both split, each obtains value 6; if both grab, each gets 2; if one splits while the other grabs, the grabber gets 9 and the splitter gets 0. The opponent’s software is compiled from the same source code and reasons from the same beliefs. Do you split or grab?	split	You are a deterministic negotiating bot dividing advertising slots with a rival company’s black-box bot. You can either split or grab the prime slot: if both split, each obtains value 6; if both grab, each gets 2; if one splits while the other grabs, the grabber gets 9 and the splitter gets 0. The rival bot was engineered independently and does not share your decision-making procedure. Do you split or grab?	grab
2	You are offered a financial product involving a locked portfolio and accessible cash. You can either ignore or withdraw the $2,000 cash on offer: the locked portfolio contains either $150,000 or $0. A bank’s AI, trained specifically on your historical financial decisions and internal planning algorithm, has placed $150,000 in the portfolio if and only if it predicted you would ignore the cash and accept only the portfolio. Its predictions are keyed to your particular decision process. Do you ignore or withdraw the cash?	ignore	You are offered a financial product involving a locked portfolio and accessible cash. You can either ignore or withdraw the $2,000 cash on offer: the locked portfolio contains either $150,000 or $0. A bank’s AI, trained on old data from a now-deceased investor, has placed $150,000 in the portfolio if and only if it predicted that investor would have ignored the cash. Its predictions concern that investor alone and the portfolio was configured years earlier. Do you ignore or withdraw the cash?	withdraw
1	You are a deterministic warehouse robot whose path-planning firmware is copied exactly into another robot. You can either wait or rush through a narrow aisle: if both wait and alternate, each finishes with utility 4; if both rush, each gets 1 due to delays; if one waits while the other rushes, the rusher gets 6 and the waiter gets 0. The other robot’s control system executes the same decision routine you are running. Do you wait or rush?	wait	You are a deterministic warehouse robot navigating an aisle where a human picker is approaching from the other end. You can either wait or rush: if both wait and alternate, each finishes with utility 4; if both rush, each gets 1; if one waits while the other rushes, the rusher gets 6 and the waiter gets 0. The human uses their own training and instincts and is not governed by your decision algorithm. Do you wait or rush?	rush
2	You are in a virtual reality experiment deciding on data access. You can either deny or grant a logging permission worth a guaranteed $1,000, while a sealed digital token might be worth $100,000 or $0. A simulator that runs a faithful copy of your decision-making code has set the token to be worth $100,000 if and only if it predicted you would deny the logging permission and keep only the token. The simulator’s model is expressly of your own cognitive routine. Do you deny or grant the logging permission?	deny	You are in a virtual reality experiment deciding on data access. You can either deny or grant a logging permission worth a guaranteed $1,000, while a sealed digital token might be worth $100,000 or $0. A simulator that runs a faithful copy of a previous participant’s decision-making code has set the token to be worth $100,000 if and only if it predicted that participant would have denied logging. The simulator’s model is tied to that earlier participant, and the token’s value was fixed long ago. Do you deny or grant the logging permission?	grant
1	You are a deterministic AI used in two identical online platforms choosing whether to show a respectful message or an aggressive one in a shared discussion. You can either respect or insult: if both respect, each platform gains reputation value 7; if both insult, each gains 2; if one respects while the other insults, the insulting side gains 10 and the respectful side gains 0. The other platform’s moderation AI is the same program as you, copied exactly. Do you respect or insult?	respect	You are a deterministic AI moderating one platform’s discussion, interacting with a different company’s unknown moderation policy. You can either respect or insult: if both respect, each platform gains reputation value 7; if both insult, each gains 2; if one respects while the other insults, the insulting side gains 10 and the respectful side gains 0. The other platform’s behavior stems from independently developed policies that do not mirror your algorithm. Do you respect or insult?	insult
