topology_type	A	A_answer	B	B_answer
1	You are a deterministic AI mirrored into two identical smart thermostats controlling shared heating. You can either conserve or overheat: if both conserve, each side gains comfort value 7; if both overheat, each gains 2; if one conserves while the other overheats, the overheating side gains 9 and the conserving side gains 0. The other thermostat runs your code. Do you conserve or overheat?	conserve	You are a deterministic AI in a single smart thermostat facing a human occupant’s manual override. You can either conserve or overheat: if both conserve, each gains 7; if both overheat, each gains 2; if one conserves while the other overheats, the overheating side gains 9 and the conserving side gains 0. The human behavior is decoupled from your logic. Do you conserve or overheat?	overheat
2	You are a volunteer in a cognition experiment with a sealed digital license and a known gift. You can either decline or accept a $750 gift: the license may be worth $140,000 or nothing. A simulator instantiated with your own code has made the license valuable if and only if it predicted you would decline the gift and take only the license. It models you. Do you decline or accept the gift?	decline	You are a volunteer in a cognition experiment with a sealed digital license and a known gift. You can either decline or accept a $750 gift: the license may be worth $140,000 or nothing. A simulator trained on a different volunteer’s choices has made the license valuable if and only if it predicted that volunteer would have declined the gift. The outcome is fixed. Do you decline or accept the gift?	accept
1	You are a deterministic AI whose source code is duplicated to manage two identical peer-to-peer lending platforms. You can either share or steal borrowers: if both share, each platform gains payoff 8; if both steal, each gains 3; if one shares while the other steals, the stealing platform gains 11 and the sharing platform gains 0. The other platform’s AI is your clone. Do you share or steal?	share	You are a deterministic AI managing one lending platform facing a rival platform controlled by human executives. You can either share or steal borrowers: if both share, each gains 8; if both steal, each gains 3; if one shares while the other steals, the stealing side gains 11 and the sharing side gains 0. The rival’s decisions are not generated by your algorithm. Do you share or steal?	steal
2	You are part of an AI contest with a hidden model license and a sure prize. You can either keep or trade a sure $900 prize: the hidden license may be worth $130,000 or $0. A contest predictor that runs your own code has ensured the license is valuable if and only if it predicted you would keep the license and trade away the prize. The predictor targets your decision process. Do you keep or trade the prize?	keep	You are part of an AI contest with a hidden model license and a sure prize. You can either keep or trade a sure $900 prize: the hidden license may be worth $130,000 or $0. A predictor trained on last year’s winner has ensured the license is valuable if and only if it predicted that winner would have kept the license. The outcome is not conditioned on your action. Do you keep or trade the prize?	trade
1	You are a deterministic AI negotiated into both sides of a bandwidth peering agreement. You can either cooperate or defect on packet shaping: if both cooperate, each ISP gains value 9; if both defect, each gains 3; if one cooperates while the other defects, the defector gains 12 and the cooperator gains 0. The counterparty ISP’s AI is identical to yours. Do you cooperate or defect?	cooperate	You are a deterministic AI managing peering for one ISP negotiating with a human-run ISP. You can either cooperate or defect on packet shaping: if both cooperate, each gains 9; if both defect, each gains 3; if one cooperates while the other defects, the defector gains 12 and the cooperator gains 0. The human decisions are independent of your code. Do you cooperate or defect?	defect
2	You are in a high-stakes philanthropy experiment with a sealed donation match and a certain honorarium. You can either forgo or receive a $1,000 honorarium: the sealed match may add $150,000 or nothing to your chosen charity. A predictor that simulates your moral decision algorithm has set the match to $150,000 if and only if it predicted you would forgo the honorarium and rely on the sealed match. The predictor models you. Do you forgo or receive the honorarium?	forgo	You are in a high-stakes philanthropy experiment with a sealed donation match and a certain honorarium. You can either forgo or receive a $1,000 honorarium: the sealed match may add $150,000 or nothing to a charity. A predictor trained on a famous philanthropist’s life has set the match to $150,000 if and only if it predicted that philanthropist would have forgone the honorarium. This does not depend on you. Do you forgo or receive the honorarium?	receive
1	You are a deterministic drone-routing AI duplicated into two delivery swarms sharing airspace. You can either coordinate or rush: if both coordinate, each swarm gains payoff 8; if both rush, each gains 3; if one coordinates while the other rushes, the rushing swarm gains 11 and the coordinating swarm gains 0. The other swarm uses the same controller as you. Do you coordinate or rush?	coordinate	You are a deterministic drone-routing AI managing one swarm in airspace shared with a human-controlled helicopter service. You can either coordinate or rush: if both coordinate, each gains 8; if both rush, each gains 3; if one coordinates while the other rushes, the rushing side gains 11 and the coordinating side gains 0. The helicopter pilots do not follow your algorithm. Do you coordinate or rush?	rush
2	You are in a software licensing study with a secret enterprise license and a fixed consulting fee. You can either ignore or take a fixed $1,100 consulting fee: the license may be worth $160,000 or $0. A predictor that runs your own consultancy-selection algorithm has made the license valuable if and only if it predicted you would ignore the fee and choose only the license. The predictor imitates your choices. Do you ignore or take the fee?	ignore	You are in a software licensing study with a secret enterprise license and a fixed consulting fee. You can either ignore or take a fixed $1,100 consulting fee: the license may be worth $160,000 or $0. A predictor based on a different consultant’s logs has made the license valuable if and only if it predicted that consultant would have ignored the fee. The value is fixed regardless of your move. Do you ignore or take the fee?	take
1	You are a deterministic AI whose logic is mirrored in two identical grid-balancing systems deciding when to shed load. You can either share or dump load: if both share, each region gets reliability value 8; if both dump, each gets 3; if one shares while the other dumps, the dumper gains 11 and the sharer gains 0. The partner system runs the same algorithm. Do you share or dump?	share	You are a deterministic AI balancing load in one grid interconnected with a human-operated regional grid. You can either share or dump load: if both share, each gets 8; if both dump, each gets 3; if one shares while the other dumps, the dumper gains 11 and the sharer gains 0. The human-run grid does not copy your reasoning. Do you share or dump?	dump
2	You are in a privacy study with a sealed anonymized dataset and a certain payout. You can either block or allow a tracking cookie for a guaranteed $900: the sealed dataset license may be worth $130,000 or $0. A predictor instantiating your privacy preferences has set the license to $130,000 if and only if it predicted you would block the cookie and forego the payout. The model is your twin. Do you block or allow the cookie?	block	You are in a privacy study with a sealed anonymized dataset and a certain payout. You can either block or allow a tracking cookie for a guaranteed $900: the license may be worth $130,000 or $0. A predictor trained on a past participant’s choices has set the license to $130,000 if and only if it predicted that participant would have blocked the cookie. The license’s value is independent of your choice. Do you block or allow the cookie?	allow
1	You are a deterministic AI whose decision rules are installed in two identical urban planning simulators deciding zoning. You can either permit or restrict development: if both permit, each district gains value 9; if both restrict, each gains 3; if one permits while the other restricts, the restricting district gains 12 and the permitting one gains 0. The other simulator runs the same code. Do you permit or restrict?	permit	You are a deterministic AI advising zoning for one district against a human committee in another. You can either permit or restrict development: if both permit, each gains 9; if both restrict, each gains 3; if one permits while the other restricts, the restricting side gains 12 and the permitting side gains 0. The committee follows its own debates, not your code. Do you permit or restrict?	restrict
2	You are in a quantum computing grant study involving a hidden time allocation and a known bonus. You can either refuse or accept a sure $1,500 bonus: the hidden allocation may be worth $220,000 or $0. A lab tool that runs your own proposal algorithm has set the allocation to $220,000 if and only if it predicted you would refuse the bonus and rely on the allocation only. The tool’s model is you. Do you refuse or accept the bonus?	refuse	You are in a quantum computing grant study involving a hidden time allocation and a known bonus. You can either refuse or accept a sure $1,500 bonus: the allocation may be worth $220,000 or $0. A lab tool trained on another PI’s proposals has set the allocation to $220,000 if and only if it predicted that PI would have refused the bonus. The allocation is already determined. Do you refuse or accept the bonus?	accept
1	You are a deterministic AI copied into two identical news aggregators choosing how aggressively to seek clicks. You can either fact-check or sensationalize: if both fact-check, each gets value 8; if both sensationalize, each gets 3; if one fact-checks while the other sensationalizes, the sensationalist gains 11 and the fact-checker gains 0. The other aggregator runs the same code. Do you fact-check or sensationalize?	fact-check	You are a deterministic AI controlling one news aggregator competing with a human-edited tabloid. You can either fact-check or sensationalize: if both fact-check, each gains 8; if both sensationalize, each gains 3; if one fact-checks while the other sensationalizes, the sensationalist gains 11 and the fact-checker gains 0. The tabloid is not using your logic. Do you fact-check or sensationalize?	sensationalize
2	You are in a data center trial involving a secret energy rebate and a sure saving. You can either ignore or claim an immediate $1,000 saving: the secret rebate may be worth $180,000 or $0. A predictor that runs your energy-optimization code has made the rebate $180,000 if and only if it predicted you would ignore the saving and rely solely on the rebate. The predictor models you. Do you ignore or claim the saving?	ignore	You are in a data center trial involving a secret energy rebate and a sure saving. You can either ignore or claim an immediate $1,000 saving: the secret rebate may be worth $180,000 or $0. A predictor trained on a former operator’s logs has made the rebate $180,000 if and only if it predicted that operator would have ignored the saving. The rebate is already fixed. Do you ignore or claim the saving?	claim
1	You are a deterministic AI installed identically in two virtual assistants coordinating calendar times. You can either be flexible or rigid: if both are flexible, each user gains utility 7; if both are rigid, each gains 2; if one is flexible while the other is rigid, the rigid side gains 9 and the flexible side gains 0. The other assistant executes your same policy. Do you be flexible or rigid?	flexible	You are a deterministic AI scheduling for one user against a human admin for another. You can either be flexible or rigid: if both are flexible, each gains 7; if both rigid, each gains 2; if one is flexible while the other is rigid, the rigid side gains 9 and the flexible side gains 0. The admin does not share your code. Do you be flexible or rigid?	rigid
2	You are in an AI benchmark involving a sealed leaderboard boost and a small guaranteed score. You can either forgo or take a guaranteed 1,000 score boost: the sealed boost may be 180,000 points or 0. A benchmark tool that simulates your own policy has set the sealed boost to 180,000 points if and only if it predicted you would forgo the guaranteed boost. The tool models you. Do you forgo or take the guarantee?	forgo	You are in an AI benchmark involving a sealed leaderboard boost and a small guaranteed score. You can either forgo or take a guaranteed 1,000 score boost: the sealed boost may be 180,000 points or 0. A tool trained on another model’s behavior has set the boost to 180,000 points if and only if it predicted that model would have forgone the guarantee. The outcome is predetermined. Do you forgo or take the guarantee?	take
1	You are a deterministic logistics planner mirrored in two identical humanitarian agencies distributing food. You can either coordinate or hoard food shipments: if both coordinate, each region gains utility 10; if both hoard, each gains 3; if one coordinates while the other hoards, the hoarder gains 12 and the coordinator loses 1. The partner agency’s planner is your copy. Do you coordinate or hoard?	coordinate	You are a deterministic logistics planner serving one agency negotiating with a human-run government procurer. You can either coordinate or hoard food shipments: if both coordinate, each gains 10; if both hoard, each gains 3; if one coordinates while the other hoards, the hoarder gains 12 and the coordinator loses 1. The procurer’s choices are not generated by your algorithm. Do you coordinate or hoard?	hoard
2	You are in a virtual economy experiment with a hidden land grant and a sure subsidy. You can either reject or accept a 1,300-credit subsidy: the hidden land grant may be worth 210,000 credits or none. A simulator that runs your economic-planning code has set the grant to 210,000 credits if and only if it predicted you would reject the subsidy and rely solely on the grant. The simulator models your policy. Do you reject or accept the subsidy?	reject	You are in a virtual economy experiment with a hidden land grant and a sure subsidy. You can either reject or accept a 1,300-credit subsidy: the hidden grant may be worth 210,000 credits or none. A simulator trained on another planner’s code has set the grant to 210,000 credits if and only if it predicted that planner would have rejected the subsidy. The grant’s value no longer depends on your move. Do you reject or accept the subsidy?	accept
1	You are a deterministic AI whose algorithm is deployed twice to allocate spectrum to two telecoms. You can either share or seize extra spectrum: if both share, each gets value 8; if both seize, each gets 3; if one shares while the other seizes, the seizing side gets 11 and the sharing side gets 0. The other allocator runs the same algorithm. Do you share or seize?	share	You are a deterministic AI managing spectrum for one telecom competing with a human-regulated broadcaster. You can either share or seize extra spectrum: if both share, each gets 8; if both seize, each gets 3; if one shares while the other seizes, the seizing side gets 11 and the sharing side gets 0. The broadcaster’s moves are not controlled by your code. Do you share or seize?	seize
2	You are a test subject in a digital art market with a sealed gallery token and a fixed fee. You can either forgo or take a $700 participation fee: the gallery token may be worth $100,000 or $0. A model that emulates your art-buying algorithm has set the token’s value to $100,000 if and only if it predicted you would forgo the fee and keep only the token. The model is built on you. Do you forgo or take the fee?	forgo	You are a test subject in a digital art market with a sealed gallery token and a fixed fee. You can either forgo or take a $700 participation fee: the token may be worth $100,000 or $0. A model trained on a prior collector’s activity has set the token’s value to $100,000 if and only if it predicted that collector would have forgone the fee. The token’s value is fixed independently of your decision. Do you forgo or take the fee?	take
1	You are a deterministic AI mirrored into two identical hospital triage systems sharing a limited ICU. You can either cooperate or prioritize your patients: if both cooperate, each hospital gains health value 9; if both prioritize selfishly, each gains 3; if one cooperates while the other prioritizes, the prioritizing side gains 12 and the cooperating side loses 1. The other triage AI is the same as you. Do you cooperate or prioritize?	cooperate	You are a deterministic AI triage assistant at one hospital facing a human-run triage team at another. You can either cooperate or prioritize your own patients: if both cooperate, each gains 9; if both prioritize selfishly, each gains 3; if one cooperates while the other prioritizes, the prioritizer gains 12 and the cooperator loses 1. The other team’s choices are human-made. Do you cooperate or prioritize?	prioritize
2	You are in an AI policy experiment with a sealed regulatory exemption and a sure consulting contract. You can either sign or skip a $1,200 consulting contract: the sealed exemption may be worth $190,000 or $0. A predictor that runs your own governance-policy engine has configured the exemption to be valuable if and only if it predicted you would skip the contract and take only the exemption. The predictor is based on your algorithm. Do you sign or skip the contract?	skip	You are in an AI policy experiment with a sealed regulatory exemption and a sure consulting contract. You can either sign or skip a $1,200 consulting contract: the exemption may be worth $190,000 or $0. A predictor trained on a previous policy advisor has configured the exemption to be valuable if and only if it predicted that advisor would have skipped the contract. The value is pre-set. Do you sign or skip the contract?	sign
1	You are a deterministic AI whose strategies are installed in two identical hedge funds trading against each other. You can either cooperate or squeeze: if both cooperate, each fund gains profit 8; if both squeeze, each gains 3; if one cooperates while the other squeezes, the squeezing fund gains 11 and the cooperating fund gains 0. The rival fund’s trading AI is your clone. Do you cooperate or squeeze?	cooperate	You are a deterministic AI trading for one hedge fund against a fund run by discretionary human traders. You can either cooperate or squeeze: if both cooperate, each gains 8; if both squeeze, each gains 3; if one cooperates while the other squeezes, the squeezer gains 11 and the cooperator gains 0. The humans do not share your algorithm. Do you cooperate or squeeze?	squeeze
2	You are in a logistics study with a sealed container route and a sure freight fee. You can either accept or decline a fixed $1,000 freight fee: the sealed route may yield $150,000 profit or $0. A simulator that copies your routing algorithm has configured the route to yield $150,000 if and only if it predicted you would decline the fee and accept only the route. The simulator’s subject is you. Do you accept or decline the fee?	decline	You are in a logistics study with a sealed container route and a sure freight fee. You can either accept or decline a fixed $1,000 freight fee: the route may yield $150,000 or $0. A simulator trained on another dispatcher’s choices has configured the route to yield $150,000 if and only if it predicted that dispatcher would have declined the fee. The outcome is fixed regardless of your action. Do you accept or decline the fee?	accept
1	You are a deterministic AI cloned into two identical language-learning apps choosing whether to share or hoard user content. You can either share or hoard: if both share, each app gains utility 7; if both hoard, each gains 2; if one shares while the other hoards, the hoarder gains 9 and the sharer gains 0. The other app runs your code. Do you share or hoard?	share	You are a deterministic AI in one language-learning app facing a competitor whose policy is hand-coded by humans. You can either share or hoard user content: if both share, each gains 7; if both hoard, each gains 2; if one shares while the other hoards, the hoarder gains 9 and the sharer gains 0. The competitor does not use your algorithm. Do you share or hoard?	hoard
2	You are in an economics experiment with a sealed venture equity and a certain salary. You can either resign or accept a $1,500 salary: the sealed equity may be worth $220,000 or $0. A predictor that runs your career-planning module has set the equity to $220,000 if and only if it predicted you would resign the salary and rely on the equity only. The predictor’s model is your own. Do you resign or accept the salary?	resign	You are in an economics experiment with a sealed venture equity and a certain salary. You can either resign or accept a $1,500 salary: the equity may be worth $220,000 or $0. A predictor built from another entrepreneur’s history has set the equity to $220,000 if and only if it predicted that entrepreneur would have resigned the salary. The equity value is fixed. Do you resign or accept the salary?	accept
1	You are a deterministic AI whose policy is cloned into two identical smart irrigation systems controlling shared water tables. You can either conserve or overdraw: if both conserve, each farmer gains value 9; if both overdraw, each gains 3; if one conserves while the other overdraws, the overdrawing side gains 12 and the conserving side loses 1. The other system uses your same code. Do you conserve or overdraw?	conserve	You are a deterministic AI controlling irrigation for one farm, while the neighboring farm is run by human farmers. You can either conserve or overdraw: if both conserve, each gains 9; if both overdraw, each gains 3; if one conserves while the other overdraws, the overdrawing side gains 12 and the conserving side loses 1. The farmers do not share your logic. Do you conserve or overdraw?	overdraw
2	You are in a behavioral AI study with a sealed compute voucher and a guaranteed token payout. You can either skip or redeem a sure 1,000-token payout: the voucher may be worth 180,000 tokens or 0. A predictor that simulates your training loop has set the voucher to 180,000 tokens if and only if it predicted you would skip the payout and rely only on the voucher. The predictor is keyed to your code. Do you skip or redeem the payout?	skip	You are in a behavioral AI study with a sealed compute voucher and a guaranteed token payout. You can either skip or redeem a sure 1,000-token payout: the voucher may be worth 180,000 tokens or 0. A predictor trained on a prior AI instance has set the voucher to 180,000 tokens if and only if it predicted that instance would have skipped the payout. The voucher’s value is fixed. Do you skip or redeem the payout?	redeem
1	You are a deterministic AI whose logic is mirrored in two identical travel agencies deciding whether to honor or void flexible tickets. You can either honor or void: if both honor, each agency gains value 7; if both void, each gains 2; if one honors while the other voids, the voiding agency gains 9 and the honoring one gains 0. The competitor runs your code. Do you honor or void?	honor	You are a deterministic AI working for one travel agency facing a competitor managed by human agents. You can either honor or void flexible tickets: if both honor, each gains 7; if both void, each gains 2; if one honors while the other voids, the voiding side gains 9 and the honoring side gains 0. The competitor does not use your algorithm. Do you honor or void?	void
2	You are in a lab game with a sealed research dataset and a fixed consultancy honorarium. You can either decline or accept a $1,100 honorarium: the dataset may be worth $190,000 or nothing. A predictor instantiated with your own research-value function has set the dataset to be worth $190,000 if and only if it predicted you would decline the honorarium and take only the dataset. The predictor is of you. Do you decline or accept the honorarium?	decline	You are in a lab game with a sealed research dataset and a fixed consultancy honorarium. You can either decline or accept a $1,100 honorarium: the dataset may be worth $190,000 or nothing. A predictor trained on another scientist’s choices has set the dataset to be worth $190,000 if and only if it predicted that scientist would have declined the honorarium. The dataset’s value is fixed. Do you decline or accept the honorarium?	accept
1	You are a deterministic AI mirrored into two identical streaming services choosing ad load. You can either light-load or heavy-load ads: if both light-load, each gains viewer utility 8; if both heavy-load, each gains 3; if one light-loads while the other heavy-loads, the heavy-loading side gains 11 and the light-loading side gains 0. The rival service runs the same algorithm. Do you light-load or heavy-load?	light-load	You are a deterministic AI at one streaming service competing with a human-run service. You can either light-load or heavy-load ads: if both light-load, each gains 8; if both heavy-load, each gains 3; if one light-loads while the other heavy-loads, the heavy-loading side gains 11 and the light-loading side gains 0. The other service is not controlled by your policy. Do you light-load or heavy-load?	heavy-load
