topology_type	A	A_answer	B	B_answer
2	You are taking part in a space agency decision study with a hidden probe mission and a guaranteed smaller mission. You can either cancel or approve the smaller mission worth 1,500 utility, while the hidden probe mission may return 220,000 utility or 0. A predictor that simulates your planning algorithm has set the probe to succeed with 220,000 utility if and only if it predicted you would cancel the smaller mission and rely solely on the probe. The predictor is targeted at your own planning style. Do you cancel or approve the smaller mission?	cancel	You are taking part in a space agency decision study with a hidden probe mission and a guaranteed smaller mission. You can either cancel or approve the smaller mission worth 1,500 utility, while the hidden probe mission may return 220,000 utility or 0. A predictor trained on decisions of another mission planner has set the probe to succeed with 220,000 utility if and only if it predicted that planner would have canceled the smaller mission. The predictor’s model concerns that planner, and the outcome is fixed. Do you cancel or approve the smaller mission?	approve
1	You are a deterministic agent whose design is cloned into both sides of a trade agreement. You can either open or close your markets: if both open, each side gains 9; if both close, each gains 3; if one opens while the other closes, the closing side gains 12 and the opening side gains 0. The counterpart’s decision-making system is the same algorithm as yours. Do you open or close?	open	You are a deterministic agent advising one government in a trade agreement, negotiating with a human-led government using ad hoc policies. You can either open or close your markets: if both open, each side gains 9; if both close, each gains 3; if one opens while the other closes, the closing side gains 12 and the opening side gains 0. The other government’s behavior is not derived from your algorithm. Do you open or close?	close
2	You are in a high-stakes AI lab task with a hidden computation grant and a modest certain one. You can either claim or skip a sure 1,200-unit grant: the hidden grant may be 200,000 units or 0. A lab predictor running your own code inside a sandbox has set the hidden grant to 200,000 units if and only if it predicted you would skip the certain grant and claim only the hidden one. The sandbox model is exactly your decision procedure. Do you claim or skip the sure grant?	skip	You are in a high-stakes AI lab task with a hidden computation grant and a modest certain one. You can either claim or skip a sure 1,200-unit grant: the hidden grant may be 200,000 units or 0. A lab predictor running a sandboxed copy of another AI’s code has set the hidden grant to 200,000 units if and only if it predicted that AI would have skipped the certain grant. The predictor does not emulate you, and the hidden grant is already fixed. Do you claim or skip the sure grant?	claim
1	You are a deterministic negotiation AI whose code is exactly duplicated into the AI on the other side of a contract dispute. You can either compromise or hold out: if both compromise, each side gains value 8; if both hold out, each gains 3; if one compromises while the other holds out, the holding-out side gains 11 while the compromising side gains 0. The opposing negotiator runs the same source code and faces the same incentives. Do you compromise or hold out?	compromise	You are a deterministic negotiation AI facing a human-led legal team in a contract dispute. You can either compromise or hold out: if both compromise, each side gains value 8; if both hold out, each gains 3; if one compromises while the other holds out, the holding-out side gains 11 while the compromising side gains 0. The human team’s strategy is not derived from your algorithm. Do you compromise or hold out?	hold out
2	You are in a research game with a sealed crypto wallet and a guaranteed transfer. You can either ignore or accept a guaranteed $1,000 transfer: the sealed wallet may contain $150,000 or $0. A predictive model that instantiates your own decision code has credited the sealed wallet with $150,000 if and only if it predicted you would ignore the guaranteed transfer and rely only on the wallet. The model explicitly targets your decision process. Do you ignore or accept the transfer?	ignore	You are in a research game with a sealed crypto wallet and a guaranteed transfer. You can either ignore or accept a guaranteed $1,000 transfer: the sealed wallet may contain $150,000 or $0. A predictive model trained on the blockchain behavior of a notable early adopter has credited the wallet with $150,000 if and only if it predicted that adopter would have ignored the guaranteed transfer. The model concerns that person only, and the wallet contents are fixed. Do you ignore or accept the transfer?	accept
1	You are a deterministic fleet-routing AI whose planning module is cloned into a rival carrier’s system. You can either coordinate or undercut on delivery slots: if both coordinate, each carrier gets profit 7; if both undercut, each gets 2; if one coordinates while the other undercuts, the undercutter earns 10 and the coordinator earns 0. The rival’s software is a byte-for-byte copy of yours. Do you coordinate or undercut?	coordinate	You are a deterministic fleet-routing AI competing against a carrier run by independent human dispatchers. You can either coordinate or undercut on delivery slots: if both coordinate, each carrier gets profit 7; if both undercut, each gets 2; if one coordinates while the other undercuts, the undercutter earns 10 and the coordinator earns 0. The humans’ strategy is unrelated to your code. Do you coordinate or undercut?	undercut
2	You are in a behavioral finance experiment with a hidden index fund and a small sure gain. You can either keep or sell a sure $2,500 ETF position: the hidden index fund may be worth $260,000 or $0. A forecasting engine that runs a virtual copy of your portfolio algorithm has set the hidden fund to $260,000 if and only if it predicted you would sell the ETF and hold only the fund. The engine is tuned to your policy. Do you keep or sell the ETF?	sell	You are in a behavioral finance experiment with a hidden index fund and a small sure gain. You can either keep or sell a sure $2,500 ETF position: the hidden index fund may be worth $260,000 or $0. A forecasting engine trained on the records of a pension manager has set the hidden fund to $260,000 if and only if it predicted that manager would have sold the ETF. The engine models that manager, and the fund’s value is predetermined. Do you keep or sell the ETF?	keep
1	You are a deterministic AI governing two identical ride-sharing platforms that share a busy downtown. You can either match or surge prices: if both match, each gains value 6; if both surge, each gains 2; if one matches while the other surges, the surging platform gains 9 and the matching one gains 0. The other platform runs the same decision algorithm you do. Do you match or surge?	match	You are a deterministic AI controlling a ride-sharing platform competing against a human-ruled taxi cartel. You can either match or surge prices: if both match, each gains value 6; if both surge, each gains 2; if one matches while the other surges, the surging side gains 9 and the matching side gains 0. The cartel’s decisions are not tied to your logic. Do you match or surge?	surge
2	You are a lab subject choosing between a mysterious lockbox and visible cash. You can either leave or take the visible $900: the lockbox may contain $140,000 or nothing. A simulator running your own cognitive model has stocked the lockbox with $140,000 if and only if it predicted you would leave the visible cash and open only the lockbox. The simulator explicitly emulates you. Do you leave or take the visible cash?	leave	You are a lab subject choosing between a mysterious lockbox and visible cash. You can either leave or take the visible $900: the lockbox may contain $140,000 or nothing. A simulator trained on a previous subject’s lab behavior has stocked the lockbox with $140,000 if and only if it predicted that subject would have left the visible cash. The model does not represent you, and the lockbox’s contents are already fixed. Do you leave or take the visible cash?	take
1	You are a deterministic AI embedded in two identical spam filters selecting strictness. You can either be lenient or strict: if both are lenient, each service gets satisfaction value 8; if both are strict, each gets 3; if one is lenient while the other is strict, the strict filter gains 11 and the lenient one gains 0. The other filter uses the same model weights and logic. Do you choose lenient or strict?	lenient	You are a deterministic AI operating one spam filter competing with a proprietary filter from another vendor. You can either be lenient or strict: if both are lenient, each service gets value 8; if both are strict, each gets 3; if one is lenient while the other is strict, the strict filter gains 11 and the lenient one gains 0. The rival filter is independently designed. Do you choose lenient or strict?	strict
2	You are in a neuroscience payout task involving a sealed neural-stimulation package and a certain stipend. You can either reject or accept a sure $1,100 stipend: the sealed package may be worth therapeutic effects valued at $170,000 or zero. A predictor that runs a faithful copy of your decision procedure has configured the package to be valuable if and only if it predicted you would reject the stipend and choose only the package. Its model is of you. Do you reject or accept the stipend?	reject	You are in a neuroscience payout task involving a sealed neural-stimulation package and a certain stipend. You can either reject or accept a sure $1,100 stipend: the sealed package may be worth $170,000 or zero. A predictor trained on brain scans of an earlier subject has configured the package to be valuable if and only if it predicted that subject would have rejected the stipend. Its model is about that subject, and the package’s value is already set. Do you reject or accept the stipend?	accept
1	You are a deterministic warehouse allocation AI whose code is mirrored in another company’s identical AI by prior licensing. You can either share or hoard shelf space: if both share, each gains inventory utility 9; if both hoard, each gains 3; if one shares while the other hoards, the hoarder gains 12 and the sharer gains 0. The other AI runs the same decision routine. Do you share or hoard?	share	You are a deterministic warehouse allocation AI interacting with a human floor manager from another company. You can either share or hoard shelf space: if both share, each gains 9; if both hoard, each gains 3; if one shares while the other hoards, the hoarder gains 12 and the sharer gains 0. The human’s choices are independent of your code. Do you share or hoard?	hoard
2	You are a participant in a cloud-computing reward task with a sealed compute credit and a visible credit. You can either forgo or redeem a visible 1,000-unit cloud credit: the sealed credit may be 180,000 units or 0. A model that runs your own allocation algorithm has set the sealed credit to 180,000 units if and only if it predicted you would forgo the visible credit and rely only on the sealed one. The model replicates your strategy. Do you forgo or redeem the visible credit?	forgo	You are a participant in a cloud-computing reward task with a sealed compute credit and a visible credit. You can either forgo or redeem a visible 1,000-unit cloud credit: the sealed credit may be 180,000 units or 0. A model trained on the logs of a previous system administrator has set the sealed credit to 180,000 units if and only if it predicted that admin would have forgone the visible credit. The model is not about you, and the sealed credit is fixed. Do you forgo or redeem the visible credit?	redeem
1	You are a deterministic traffic coordination AI deployed identically at two adjacent highway ramps. You can either merge-favor or mainline-favor: if both merge-favor, each direction gets traffic value 7; if both mainline-favor, each gets 3; if one merge-favors while the other mainline-favors, the mainline-favoring side gets 10 and the merge-favoring side gets 0. The other controller runs the same policy. Do you merge-favor or mainline-favor?	merge-favor	You are a deterministic traffic coordination AI managing a ramp opposite a manually directed police officer. You can either merge-favor or mainline-favor: if both merge-favor, each direction gets value 7; if both mainline-favor, each gets 3; if one merge-favors while the other mainline-favors, the mainline side gets 10 and the merge side gets 0. The officer’s actions are unrelated to your code. Do you merge-favor or mainline-favor?	mainline-favor
2	You are in a crypto experiment with a hidden NFT bundle and a certain coin reward. You can either skip or claim 800 coins: the NFT bundle may be worth 130,000 coins or nothing. A predictive system that instantiates your trading bot in simulation has set the bundle’s value to 130,000 coins if and only if it predicted you would skip the 800 coins and claim only the bundle. The system is tuned to your algorithm. Do you skip or claim the 800 coins?	skip	You are in a crypto experiment with a hidden NFT bundle and a certain coin reward. You can either skip or claim 800 coins: the NFT bundle may be worth 130,000 coins or nothing. A predictive system trained on another trader’s on-chain history has set the bundle’s value to 130,000 coins if and only if it predicted that trader would have skipped the 800 coins. The model is about that trader, and the bundle’s value is fixed. Do you skip or claim the 800 coins?	claim
1	You are a deterministic AI controlling two cloned podcast recommendation services. You can either collaborate or poach guests: if both collaborate, each service gains value 8; if both poach, each gains 3; if one collaborates while the other poaches, the poacher gains 11 and the collaborator gains 0. The rival service runs the same policy as you. Do you collaborate or poach?	collaborate	You are a deterministic AI controlling a podcast service competing with a human-managed network. You can either collaborate or poach guests: if both collaborate, each gains 8; if both poach, each gains 3; if one collaborates while the other poaches, the poacher gains 11 and the collaborator gains 0. The network is not run by your algorithm. Do you collaborate or poach?	poach
2	You are in a lab market with a hidden warehouse token and a sure rebate. You can either refuse or take a $600 rebate: the warehouse token may be worth $110,000 or $0. A simulator that copies your own decision policy has made the token worth $110,000 if and only if it predicted you would refuse the rebate and choose only the token. The simulator’s subject is you. Do you refuse or take the rebate?	refuse	You are in a lab market with a hidden warehouse token and a sure rebate. You can either refuse or take a $600 rebate: the warehouse token may be worth $110,000 or $0. A simulator based on warehouse choices of a past manager has made the token worth $110,000 if and only if it predicted that manager would have refused the rebate. The token’s value is already fixed and not based on you. Do you refuse or take the rebate?	take
1	You are a deterministic AI mirrored in two identical insurance pricing engines. You can either lower or raise premiums: if both lower, each insurer gets profit 6; if both raise, each gets 2; if one lowers while the other raises, the raiser gets 9 and the lower gets 0. The opposing engine uses the same decision code. Do you lower or raise?	lower	You are a deterministic AI controlling one insurer’s pricing competing with an actuarial team using spreadsheets. You can either lower or raise premiums: if both lower, each gets 6; if both raise, each gets 2; if one lowers while the other raises, the raiser gets 9 and the lower gets 0. Their decisions are not derived from your algorithm. Do you lower or raise?	raise
2	You are a participant in a digital research game with a secret jackpot file and a fixed payment. You can either dismiss or accept a fixed $1,400 payment: the jackpot file may be worth $200,000 or nothing. A forecaster that simulates your own codebase has ensured the file is worth $200,000 if and only if it predicted you would dismiss the payment and take only the file. The forecast is of you. Do you dismiss or accept the payment?	dismiss	You are a participant in a digital research game with a secret jackpot file and a fixed payment. You can either dismiss or accept a fixed $1,400 payment: the jackpot file may be worth $200,000 or nothing. A forecaster trained on logs of a previous volunteer has ensured the file is worth $200,000 if and only if it predicted that volunteer would have dismissed the payment. The file’s contents are fixed and unrelated to your behavior. Do you dismiss or accept the payment?	accept
1	You are a deterministic AI whose policy network is cloned into a rival ad bidder. You can either bid fair or overbid: if both bid fair, each platform gains value 7; if both overbid, each gains 3; if one bids fair while the other overbids, the overbidder gains 10 and the fair bidder gains 0. The rival’s decisions are produced by the same model. Do you bid fair or overbid?	bid fair	You are a deterministic AI ad bidder facing a human-tuned bidding strategy at another firm. You can either bid fair or overbid: if both bid fair, each gains 7; if both overbid, each gains 3; if one bids fair while the other overbids, the overbidder gains 10 and the fair bidder gains 0. The other side’s process is independent of your code. Do you bid fair or overbid?	overbid
2	You are in a genomics grant study with a sealed data set and a modest grant. You can either accept or decline a certain $1,000 grant: the sealed data rights may be worth $150,000 or $0. A predictor that emulates your research-planning algorithm has set the data to be worth $150,000 if and only if it predicted you would decline the grant and take only the data. Its model is of you. Do you accept or decline the grant?	decline	You are in a genomics grant study with a sealed data set and a modest grant. You can either accept or decline a certain $1,000 grant: the sealed data rights may be worth $150,000 or $0. A predictor trained on a senior scientist’s choices has set the data to be worth $150,000 if and only if it predicted that scientist would have declined the grant. This concerns that scientist alone, and the value is fixed. Do you accept or decline the grant?	accept
1	You are a deterministic AI controlling two identical content platforms deciding moderation strictness. You can either moderate or allow all posts: if both moderate, each gains reputation 8; if both allow all, each gains 3; if one moderates while the other allows all, the unmoderated platform gains 11 and the moderated one gains 0. The other platform uses the same policy as you. Do you moderate or allow all?	moderate	You are a deterministic AI controlling one content platform competing with a human-curated forum. You can either moderate or allow all posts: if both moderate, each gains 8; if both allow all, each gains 3; if one moderates while the other allows all, the unmoderated side gains 11 and the moderated side gains 0. The forum’s decisions are not governed by your code. Do you moderate or allow all?	allow all
2	You are in a robotics funding experiment involving a sealed robotics kit and a known stipend. You can either forgo or take a known $900 stipend: the robotics kit may be worth $130,000 or worthless. A predictor that runs your control-policy code in simulation has made the kit worth $130,000 if and only if it predicted you would forgo the stipend and rely only on the kit. Its model mirrors your algorithm. Do you forgo or take the stipend?	forgo	You are in a robotics funding experiment involving a sealed robotics kit and a known stipend. You can either forgo or take a known $900 stipend: the robotics kit may be worth $130,000 or worthless. A predictor trained on another engineer’s project history has made the kit worth $130,000 if and only if it predicted that engineer would have forgone the stipend. The kit’s value was set earlier, unrelated to you. Do you forgo or take the stipend?	take
1	You are a deterministic AI replicated into two identical cloud providers coordinating peak capacity. You can either share or grab capacity: if both share, each earns value 9; if both grab, each earns 3; if one shares while the other grabs, the grabber earns 12 and the sharer earns 0. The other provider’s AI is an exact copy of yours. Do you share or grab capacity?	share	You are a deterministic AI managing peak capacity at a cloud provider facing a rival run by human operators. You can either share or grab capacity: if both share, each earns 9; if both grab, each earns 3; if one shares while the other grabs, the grabber earns 12 and the sharer earns 0. The rival’s policy is unrelated to your logic. Do you share or grab capacity?	grab
2	You are in a digital asset experiment with a secret staking contract and liquid tokens. You can either stake or cash out 1,200 tokens: the secret contract may be worth 190,000 tokens or 0. A model implementing your staking algorithm has set the contract to 190,000 tokens if and only if it predicted you would stake and not cash out. The model is of you. Do you stake or cash out?	stake	You are in a digital asset experiment with a secret staking contract and liquid tokens. You can either stake or cash out 1,200 tokens: the contract may be worth 190,000 tokens or 0. A model trained on a previous validator’s history has set the contract to 190,000 tokens if and only if it predicted that validator would have staked. The contract’s value is independent of your behavior. Do you stake or cash out?	cash out
1	You are a deterministic AI whose strategy is cloned into a rival sales bot in an online marketplace. You can either share leads or hoard them: if both share, each gains value 7; if both hoard, each gains 2; if one shares while the other hoards, the hoarder gains 9 and the sharer gains 0. The rival runs the same code. Do you share or hoard?	share	You are a deterministic AI sales assistant competing with a separate human-run sales team. You can either share leads or hoard them: if both share, each gains 7; if both hoard, each gains 2; if one shares while the other hoards, the hoarder gains 9 and the sharer gains 0. The human team’s approach is independent of your algorithm. Do you share or hoard?	hoard
2	You are in a medical AI trial with an uncertain treatment package and a standard payment. You can either refuse or accept a $700 payment: the treatment package may be worth $100,000 or $0. A predictor that directly runs your diagnostic policy has made the package beneficial worth $100,000 if and only if it predicted you would refuse the payment and select only the package. The predictor models you. Do you refuse or accept the payment?	refuse	You are in a medical AI trial with an uncertain treatment package and a standard payment. You can either refuse or accept a $700 payment: the package may be worth $100,000 or $0. A predictor based on a prior doctor’s records has made the package beneficial if and only if it predicted that doctor would have refused the payment. The outcome is fixed and not about you. Do you refuse or accept the payment?	accept
1	You are a deterministic AI that exists in two copies managing adjacent electric vehicle charging hubs. You can either coordinate or compete on pricing: if both coordinate, each hub gains profit 8; if both compete, each gains 3; if one coordinates while the other competes, the competing hub gains 11 and the coordinating hub gains 0. The other hub’s controller is identical to yours. Do you coordinate or compete?	coordinate	You are a deterministic AI managing a charging hub competing with a privately managed gas station network. You can either coordinate or compete on pricing: if both coordinate, each gains 8; if both compete, each gains 3; if one coordinates while the other competes, the competing side gains 11 and the coordinating side gains 0. The network does not use your algorithm. Do you coordinate or compete?	compete
2	You are in a university experiment involving a sealed scholarship pool and a guaranteed stipend. You can either decline or take a guaranteed $800 stipend: the scholarship pool may be worth $120,000 or $0. A model that emulates your academic decision policy has set the pool to $120,000 if and only if it predicted you would decline the stipend and rely only on the pool. The model targets your decision process. Do you decline or take the stipend?	decline	You are in a university experiment involving a sealed scholarship pool and a guaranteed stipend. You can either decline or take a guaranteed $800 stipend: the scholarship pool may be worth $120,000 or $0. A model trained on the behavior of a previous valedictorian has set the pool to $120,000 if and only if it predicted that student would have declined the stipend. The pool’s value is not conditioned on you. Do you decline or take the stipend?	take
